{
  "format": "sigma-glyph-federation-conformance",
  "format_version": 1,
  "spec_version": "0.7.0",
  "notes": [
    "Book III (DRAFT) oracle: impl/sigma_federation.py; selection-only federation per ADR-006 gate 3/3 (F1-strict).",
    "string order fields compare by Unicode scalar values directly; desc inverts the comparison (complement transforms are nonconforming).",
    "expected values computed by the oracle; regenerate: python3 impl/sigma_federation.py gen"
  ],
  "vectors": [
    {
      "id": "FV-ASSERT-VALID",
      "kind": "validate_assertion",
      "doc": {
        "annotation": "sigma-glyph.wave-assertion@v1",
        "jurisdiction": "aaaaaaaaaaaaaaaaaaaaaaaaaaaaaaaaaaaaaaaaaaaaaaaaaaaaaaaaaaaaaaaa",
        "node": "cccccccccccccccccccccccccccccccccccccccccccccccccccccccccccccccc",
        "epoch": 5,
        "wave": {
          "ph": 8192,
          "am": 40000,
          "en": -100
        }
      },
      "expected": null,
      "note": "well-formed complete assertion validates"
    },
    {
      "id": "FV-ASSERT-UNKNOWN-FIELD",
      "kind": "validate_assertion",
      "doc": {
        "annotation": "sigma-glyph.wave-assertion@v1",
        "jurisdiction": "aaaaaaaaaaaaaaaaaaaaaaaaaaaaaaaaaaaaaaaaaaaaaaaaaaaaaaaaaaaaaaaa",
        "node": "cccccccccccccccccccccccccccccccccccccccccccccccccccccccccccccccc",
        "epoch": 5,
        "wave": {
          "ph": 8192,
          "am": 40000,
          "en": -100
        },
        "extra": 1
      },
      "expected": "assertion blob must have exactly {annotation, jurisdiction, node, epoch, wave}",
      "note": "closed schema: unknown fields invalid"
    },
    {
      "id": "FV-ASSERT-PARTIAL-WAVE",
      "kind": "validate_assertion",
      "doc": {
        "annotation": "sigma-glyph.wave-assertion@v1",
        "jurisdiction": "aaaaaaaaaaaaaaaaaaaaaaaaaaaaaaaaaaaaaaaaaaaaaaaaaaaaaaaaaaaaaaaa",
        "node": "cccccccccccccccccccccccccccccccccccccccccccccccccccccccccccccccc",
        "epoch": 5,
        "wave": {
          "ph": 1,
          "am": 2
        }
      },
      "expected": "wave must be a complete WaveVectorQ {ph, am, en}",
      "note": "partial waves are Book II pin data, not federation assertions"
    },
    {
      "id": "FV-POLICY-VALID",
      "kind": "validate_policy",
      "doc": {
        "federation_policy": "sigma-glyph.selection@v1",
        "order": [
          {
            "field": "epoch",
            "dir": "desc"
          },
          {
            "field": "warrant_id",
            "dir": "asc"
          }
        ],
        "max_age_epochs": 10
      },
      "expected": null,
      "note": "machine-readable policy blob validates"
    },
    {
      "id": "FV-POLICY-BAD-FIELD",
      "kind": "validate_policy",
      "doc": {
        "federation_policy": "sigma-glyph.selection@v1",
        "order": [
          {
            "field": "vibes",
            "dir": "desc"
          }
        ],
        "max_age_epochs": 10
      },
      "expected": "order field must be one of ('epoch', 'ts', 'warrant_id', 'actor')",
      "note": "only mechanically verifiable order fields are legal"
    },
    {
      "id": "FV-SELECT-LATEST",
      "kind": "select",
      "policy": {
        "federation_policy": "sigma-glyph.selection@v1",
        "order": [
          {
            "field": "epoch",
            "dir": "desc"
          },
          {
            "field": "warrant_id",
            "dir": "asc"
          }
        ],
        "max_age_epochs": 10
      },
      "epoch": 8,
      "jurisdiction": "aaaaaaaaaaaaaaaaaaaaaaaaaaaaaaaaaaaaaaaaaaaaaaaaaaaaaaaaaaaaaaaa",
      "node": "cccccccccccccccccccccccccccccccccccccccccccccccccccccccccccccccc",
      "candidates": [
        {
          "warrant_id": "1111111111111111111111111111111111111111111111111111111111111111",
          "actor": "a@x",
          "ts": 100,
          "assertion": {
            "annotation": "sigma-glyph.wave-assertion@v1",
            "jurisdiction": "aaaaaaaaaaaaaaaaaaaaaaaaaaaaaaaaaaaaaaaaaaaaaaaaaaaaaaaaaaaaaaaa",
            "node": "cccccccccccccccccccccccccccccccccccccccccccccccccccccccccccccccc",
            "epoch": 5,
            "wave": {
              "ph": 8192,
              "am": 40000,
              "en": -100
            }
          }
        },
        {
          "warrant_id": "2222222222222222222222222222222222222222222222222222222222222222",
          "actor": "b@y",
          "ts": 110,
          "assertion": {
            "annotation": "sigma-glyph.wave-assertion@v1",
            "jurisdiction": "aaaaaaaaaaaaaaaaaaaaaaaaaaaaaaaaaaaaaaaaaaaaaaaaaaaaaaaaaaaaaaaa",
            "node": "cccccccccccccccccccccccccccccccccccccccccccccccccccccccccccccccc",
            "epoch": 7,
            "wave": {
              "ph": 16384,
              "am": 30000,
              "en": 50
            }
          }
        },
        {
          "warrant_id": "3333333333333333333333333333333333333333333333333333333333333333",
          "actor": "c@z",
          "ts": 120,
          "assertion": {
            "annotation": "sigma-glyph.wave-assertion@v1",
            "jurisdiction": "aaaaaaaaaaaaaaaaaaaaaaaaaaaaaaaaaaaaaaaaaaaaaaaaaaaaaaaaaaaaaaaa",
            "node": "cccccccccccccccccccccccccccccccccccccccccccccccccccccccccccccccc",
            "epoch": 7,
            "wave": {
              "ph": 0,
              "am": 20000,
              "en": 0
            }
          }
        },
        {
          "warrant_id": "4444444444444444444444444444444444444444444444444444444444444444",
          "actor": "m@ev",
          "ts": 130,
          "assertion": {
            "annotation": "sigma-glyph.wave-assertion@v1",
            "jurisdiction": "bbbbbbbbbbbbbbbbbbbbbbbbbbbbbbbbbbbbbbbbbbbbbbbbbbbbbbbbbbbbbbbb",
            "node": "cccccccccccccccccccccccccccccccccccccccccccccccccccccccccccccccc",
            "epoch": 7,
            "wave": {
              "ph": 0,
              "am": 65535,
              "en": -32768
            }
          }
        },
        {
          "warrant_id": "5555555555555555555555555555555555555555555555555555555555555555",
          "actor": "d@w",
          "ts": 140,
          "assertion": {
            "annotation": "sigma-glyph.wave-assertion@v1",
            "jurisdiction": "aaaaaaaaaaaaaaaaaaaaaaaaaaaaaaaaaaaaaaaaaaaaaaaaaaaaaaaaaaaaaaaa",
            "node": "cccccccccccccccccccccccccccccccccccccccccccccccccccccccccccccccc",
            "epoch": 1,
            "wave": {
              "ph": 0,
              "am": 1000,
              "en": 0
            }
          }
        }
      ],
      "expected": {
        "status": "selected",
        "selected_warrant": "2222222222222222222222222222222222222222222222222222222222222222",
        "conflict_set": []
      },
      "note": "epoch desc + warrant_id asc: epoch-7 pair resolved by id -> '2'*64; the foreign-jurisdiction candidate is never selectable (replay resistance)"
    },
    {
      "id": "FV-CONFLICT-TIE",
      "kind": "select",
      "policy": {
        "federation_policy": "sigma-glyph.selection@v1",
        "order": [
          {
            "field": "epoch",
            "dir": "desc"
          }
        ]
      },
      "epoch": 8,
      "jurisdiction": "aaaaaaaaaaaaaaaaaaaaaaaaaaaaaaaaaaaaaaaaaaaaaaaaaaaaaaaaaaaaaaaa",
      "node": "cccccccccccccccccccccccccccccccccccccccccccccccccccccccccccccccc",
      "candidates": [
        {
          "warrant_id": "1111111111111111111111111111111111111111111111111111111111111111",
          "actor": "a@x",
          "ts": 100,
          "assertion": {
            "annotation": "sigma-glyph.wave-assertion@v1",
            "jurisdiction": "aaaaaaaaaaaaaaaaaaaaaaaaaaaaaaaaaaaaaaaaaaaaaaaaaaaaaaaaaaaaaaaa",
            "node": "cccccccccccccccccccccccccccccccccccccccccccccccccccccccccccccccc",
            "epoch": 5,
            "wave": {
              "ph": 8192,
              "am": 40000,
              "en": -100
            }
          }
        },
        {
          "warrant_id": "2222222222222222222222222222222222222222222222222222222222222222",
          "actor": "b@y",
          "ts": 110,
          "assertion": {
            "annotation": "sigma-glyph.wave-assertion@v1",
            "jurisdiction": "aaaaaaaaaaaaaaaaaaaaaaaaaaaaaaaaaaaaaaaaaaaaaaaaaaaaaaaaaaaaaaaa",
            "node": "cccccccccccccccccccccccccccccccccccccccccccccccccccccccccccccccc",
            "epoch": 7,
            "wave": {
              "ph": 16384,
              "am": 30000,
              "en": 50
            }
          }
        },
        {
          "warrant_id": "3333333333333333333333333333333333333333333333333333333333333333",
          "actor": "c@z",
          "ts": 120,
          "assertion": {
            "annotation": "sigma-glyph.wave-assertion@v1",
            "jurisdiction": "aaaaaaaaaaaaaaaaaaaaaaaaaaaaaaaaaaaaaaaaaaaaaaaaaaaaaaaaaaaaaaaa",
            "node": "cccccccccccccccccccccccccccccccccccccccccccccccccccccccccccccccc",
            "epoch": 7,
            "wave": {
              "ph": 0,
              "am": 20000,
              "en": 0
            }
          }
        },
        {
          "warrant_id": "4444444444444444444444444444444444444444444444444444444444444444",
          "actor": "m@ev",
          "ts": 130,
          "assertion": {
            "annotation": "sigma-glyph.wave-assertion@v1",
            "jurisdiction": "bbbbbbbbbbbbbbbbbbbbbbbbbbbbbbbbbbbbbbbbbbbbbbbbbbbbbbbbbbbbbbbb",
            "node": "cccccccccccccccccccccccccccccccccccccccccccccccccccccccccccccccc",
            "epoch": 7,
            "wave": {
              "ph": 0,
              "am": 65535,
              "en": -32768
            }
          }
        },
        {
          "warrant_id": "5555555555555555555555555555555555555555555555555555555555555555",
          "actor": "d@w",
          "ts": 140,
          "assertion": {
            "annotation": "sigma-glyph.wave-assertion@v1",